<?xml version="1.0" encoding="UTF-8"?>
<!DOCTYPE curso SYSTEM "curso.dtd">
<curso>
    <asignatura>
        <titulo>Tecnologia</titulo>
        <alumnos>
            <alumno>Mamerto</alumno>
            <alumno>Lolita</alumno>
        </alumnos>
        <profesor>Eustaquio</profesor>
    </asignatura>
    <asignatura>
        <codigo>1907</codigo>
        <alumnos>
            <alumno>Angeli√±o</alumno>
            <alumno>Yengo</alumno>
        </alumnos>
        <profesor>Pou</profesor>
    </asignatura>
</curso>